{
  "$schema": "https://json-schema.org/draft/2020-12/schema",
  "title": "Supervisor Verdict",
  "description": "Structured verdict returned by pentest-supervisor subagent.",
  "type": "object",
  "required": ["verdict", "reasons", "quality_assessment", "required_actions", "halt_reason"],
  "additionalProperties": false,
  "properties": {
    "verdict": { "enum": ["proceed", "replan", "halt"] },
    "reasons": {
      "type": "array",
      "items": { "type": "string" },
      "minItems": 1
    },
    "quality_assessment": {
      "type": "object",
      "required": ["coverage_pct", "depth_score", "gaps"],
      "additionalProperties": false,
      "properties": {
        "coverage_pct": { "type": "integer", "minimum": 0, "maximum": 100 },
        "depth_score": { "type": "integer", "minimum": 0, "maximum": 10 },
        "gaps": { "type": "array", "items": { "type": "string" } }
      }
    },
    "required_actions": {
      "type": "array",
      "items": {
        "type": "object",
        "required": ["action", "phase", "reason"],
        "additionalProperties": false,
        "properties": {
          "action": { "enum": ["rerun_phase", "unlock_conditional", "skip_phase"] },
          "phase": { "type": "string" },
          "reason": { "type": "string" },
          "targets": { "type": "array", "items": { "type": "string" } },
          "rerun_params": {
            "type": "object",
            "additionalProperties": false,
            "properties": {
              "wordlist_size": { "enum": ["small", "medium", "large"] },
              "request_rate_multiplier": { "type": "number", "minimum": 0.1, "maximum": 10 },
              "additional_targets": { "type": "array", "items": { "type": "string" } },
              "extra_flags": { "type": "array", "items": { "type": "string" } }
            }
          }
        }
      }
    },
    "halt_reason": {
      "type": ["string", "null"],
      "enum": [null, "scope_violation", "roe_violation", "replan_exhausted", "supervisor_failure", "quality_critical", "user_abort"]
    }
  },
  "allOf": [
    {
      "if": { "properties": { "verdict": { "const": "halt" } } },
      "then": { "properties": { "halt_reason": { "type": "string" } } }
    },
    {
      "if": { "properties": { "verdict": { "enum": ["proceed", "replan"] } } },
      "then": { "properties": { "halt_reason": { "type": "null" } } }
    }
  ]
}
